{
  "location_id": "",
  "name": "",
  "address": {
    "street": "",
    "city": "",
    "state": "",
    "zip": ""
  },
  "phone": "",
  "neighborhoods_served": [],
  "coordinates": {
    "latitude": 0,
    "longitude": 0
  },
  "license_number": "",
  "compliance": {
    "ny_article_5_compliant": true
  }
}
